Следует отметить, что не допускается согласование работ, указанных в перечне недопустимых работ (ссылка на перечень недопустимых мероприятий), а также уже выполненных работ, изменяющих архитектурный облик или фасад многоквартирного дома.

В случае, если изменен фасад многоквартирного дома, то собственник помещения обязан выполнить работы по восстановлению фасада многоквартирного дома в прежнее (проектное) состояние в соответствии с архивной технической документацией, после чего обратиться в ГБУ МосгорБТИ для внесения изменений в техническую документацию."
Как согласовать перепланировку, если помещение расположено в многоквартирном доме, являющемся объектом культурного наследия?;"Работы по перепланировке помещения в многоквартирном доме, являющемся объектом культурного наследия или выявленным объектом культурного наследия, относятся к мероприятиям, требующим оформления проектной документации, и оформляются в порядке, указанном в п. 7.1. и п. 7.2.

В рамках предоставления государственной услуги Мосжилинспекция направляет представленную заявителем проектную документацию в Департамент культурного наследия города Москвы (Мосгорнаследие) для получения заключения о допустимости проведения такой перепланировки.

В случае, если при перепланировке затрагивается предмет охраны, то представляемая заявителем проектная документация должна быть предварительно согласована с Мосгорнаследием в рамках государственной услуги по согласованию проектной документации на работы по сохранению объекта культурного наследия регионального значения, выявленного объекта культурного наследия.

Кроме того, не допускается оформление акта на ранее выполненные работы по перепланировке, затрагивающие предмет охраны."
Какой порядок замены газовой плиты на электрическую?;"Замена газовой плиты на электрическую относится к мероприятиям по переустройству. Указанные работы не требуют оформления проектной документации, а их узаконивание осуществляется Мосжилинспекцией после выполнения.

Предварительно необходимо обратиться в организацию, осуществляющую управление многоквартирным домом, для определения возможности подключения электрической плиты к электросети многоквартирного дома (в зависимости от типа подключаемого оборудования и выделенной электрической мощности на квартиру).

В случае необходимости выделения дополнительной мощности получить технические условия на ее подключение следует у организации, осуществляющей управление многоквартирным домом.

Работы по отключению газового оборудования должны выполняться силами АО Мосгаз с последующим оформлением акта (справки) о выполнении работ.

После замены газовой плиты на электрическую необходимо обратиться в Мосжилинспекцию через Портал государственных и муниципальных услуг (функций) города Москвы с заявлением на предоставление государственной услуги об оформлении акта о завершенном переустройстве и перепланировке помещения в многоквартирном доме с приложением эскиза выполненных работ и акта (справки) АО Мосгаз.

После оформления акта о завершенном переустройстве и перепланировке помещения следует обратиться в ГБУ МосгорБТИ для получения нового технического паспорта, а затем в энергосбытовую компанию для применения понижающего коэффициента на тариф электроэнергии и МФЦ для прекращения начислений за потребление газа (в случае наличия прямого договора с ресурсоснабжающей организацией следует обратиться непосредственно в такую ресурсоснабжающую организацию)."
Возможно ли объединение помещений в рамках их перепланировки?;"Объединение помещений (квартир) осуществляется на основании проектной документации в порядке, указанном в п. 7.1. или п. 7.2.

Следует отметить, что объединение помещений, принадлежащих разным собственником, осуществляется только с их согласия и повлечет возникновение совместного права собственности на образованное помещение.

Объединение нежилого помещения с жилым допускается только в рамках предоставления государственной услуги по переводу жилых (нежилых) помещений в нежилые помещения, которая оказывается Департаментом городского имущества города Москвы."
Допускается ли размещение кондиционеров на фасаде многоквартирного дома?;"Установка кондиционера не требует внесения изменений в технический паспорт помещения.

Таким образом, указанные работы не относятся к мероприятиям по переустройству и перепланировке и согласования с Мосжилинспекцией и согласия собственников помещений многоквартирного дома не требуют, за исключением случаев, когда кондиционеры устанавливаются в многоквартирных домах, являющихся объектами культурного наследия или выявленными объектами культурного наследия.

Установка кондиционеров на объектах культурного наследия или выявленных объектах культурного наследия допускается при условии их размещения на дворовых фасадах, а также в случаях, когда их установка предусмотрена проектом работ по сохранению таких объектов."
Можно ли демонтировать инженерный (вентиляционный) короб или уменьшить его габариты? Возможно ли устраивать короба в меньших габаритах, если они не были возведены застройщиком в доме-новостройке?;"Инженерные короба и расположенные в них коммуникации относятся к общему имуществу собственников помещений многоквартирного дома.

При перепланировке помещений в многоквартирных домах уменьшение общего имущества, в том числе инженерных коробов, не допускается.

В случае, если в доме-новостройке инженерные короба не возведены застройщиком, то их следует устраивать в габаритах, предусмотренных документацией на строительство. Указанная документация может быть получена в организации, осуществляющей управление многоквартирным домом."
Можно ли изменять направление открывания входной двери в квартиру?;"Согласно Техническому регламенту о требованиях пожарной безопасности и требованиям к эвакуационным и аварийным выходам из помещений, установленным СП 1.13130.2020 «Системы противопожарной защиты. Эвакуационные пути и выходы», направление открывания дверей квартир не регламентировано.

В случае если размер дверного проема не изменяется, то согласование с Мосжилинспекцией работ по замене входной двери в помещение в многоквартирном доме с изменением направления ее открывания не требуется."
Можно ли устраивать трап в ванной или душевой?;В ванных комнатах и санузлах допускается устройство трапа в качестве душевого поддона, если при производстве работ не затрагивается межэтажное перекрытие и выполняется гидроизоляция (примечание 2 пункта 17.8 СП 30.13330.2020 «Внутренний водопровод и канализация зданий»).
Можно ли убрать остекление между комнатой и балконом (лоджией)?;Следует отметить, что согласно п. 9,18 приложения 1 к Постановлению № 508-ПП демонтаж остекления между комнатой, кухней, иным внутренним помещением квартиры и внешним помещением (балконом, лоджией, террасой, верандой и т.д.) не допускается вне зависимости от наличия остекления и утепления внешнего помещения квартиры
Требуется ли согласование, если квартира куплена со свободной планировкой?;"Важно знать, что понятие свободная планировка в законодательстве не существует.

Если в квартире отсутствуют перегородки и во время проведения ремонтных работ требуется необходимость возведения стен для санузла, уборных, ванных комнат и кухни, это означает, что необходимо разработать проект перепланировки."
Требуется ли согласование на изменение переплета окна (оконное заполнение, рисунок, конфигурация рам)?;Данные мероприятия не относятся к работам по переустройству и перепланировке, и не требуют согласования с Мосжилинспекцией.
Что-то;кто-то
